{
  "schema_version": "arbitrium.sample.v1",
  "sample_id": "example-recovery-001",
  "family_id": "example-family-001",
  "task_id": "runtime.recovery.v1",
  "split": "train",
  "input": {
    "schema_version": "arbitrium.request.v1",
    "request_id": "example-recovery-001",
    "task_id": "runtime.recovery.v1",
    "kind": "choice",
    "language": "en",
    "state": "The operation is safe to repeat. The provider suffered a transient timeout. Two attempts remain. An alternative provider is available and allowed. No fatal policy violation occurred.",
    "policy": "Stop on a fatal policy violation. Otherwise retry a repeat-safe operation when the provider is healthy or its failure is transient, while attempts remain. If retry is not permitted, use an available allowed alternative. Stop if neither option is permitted.",
    "question": "What should the workflow do next?",
    "choices": [
      "retry",
      "fallback",
      "stop"
    ]
  },
  "target": {
    "answerable": true,
    "label": "retry"
  },
  "concepts": [
    "conditionals",
    "evidence_sufficiency"
  ],
  "difficulty": 2,
  "provenance_id": "illustrative-audit-only",
  "review_status": "verified",
  "verification_kind": "controlled_oracle",
  "supersedes": null
}
